{
  "version": "v1",
  "feedback_id": "txt-fb-001",
  "session_id": "sess-123",
  "request_id": "req-456",
  "artifact_id": "outline-001",
  "workflow_stage": "outline",
  "feedback_text": "The structure is good but add clearer transition slides.",
  "sentiment_hint": "mixed",
  "tags": ["structure", "flow"],
  "language": "en",
  "created_at": "2026-04-28T12:02:00Z"
}
